No.     Time           Source                Destination           Protocol Length Info
    436 81.004647210   192.168.1.30          185.75.143.25         TCP      74     41747 → 80 [SYN] Seq=0 Win=5840 Len=0 MSS=1460 SACK_PERM=1 TSval=3837575513 TSecr=0 WS=4

Frame 436: 74 bytes on wire (592 bits), 74 bytes captured (592 bits) on interface 0
Ethernet II, Src: HonHaiPr_6e:62:a4 (70:77:81:6e:62:a4), Dst: FreeboxS_3f:47:20 (70:fc:8f:3f:47:20)
Internet Protocol Version 4, Src: 192.168.1.30, Dst: 185.75.143.25
    0100 .... = Version: 4
    .... 0101 = Header Length: 20 bytes (5)
    Differentiated Services Field: 0x00 (DSCP: CS0, ECN: Not-ECT)
    Total Length: 60
    Identification: 0x5955 (22869)
    Flags: 0x0000
    Time to live: 1
    Protocol: TCP (6)
    Header checksum: 0x563c [validation disabled]
    [Header checksum status: Unverified]
    Source: 192.168.1.30
    Destination: 185.75.143.25
Transmission Control Protocol, Src Port: 41747, Dst Port: 80, Seq: 0, Len: 0

No.     Time           Source                Destination           Protocol Length Info
    437 81.004744773   192.168.1.30          185.75.143.25         TCP      74     58585 → 80 [SYN] Seq=0 Win=5840 Len=0 MSS=1460 SACK_PERM=1 TSval=3837575513 TSecr=0 WS=4

Frame 437: 74 bytes on wire (592 bits), 74 bytes captured (592 bits) on interface 0
Ethernet II, Src: HonHaiPr_6e:62:a4 (70:77:81:6e:62:a4), Dst: FreeboxS_3f:47:20 (70:fc:8f:3f:47:20)
Internet Protocol Version 4, Src: 192.168.1.30, Dst: 185.75.143.25
    0100 .... = Version: 4
    .... 0101 = Header Length: 20 bytes (5)
    Differentiated Services Field: 0x00 (DSCP: CS0, ECN: Not-ECT)
    Total Length: 60
    Identification: 0x5956 (22870)
    Flags: 0x0000
    Time to live: 1
    Protocol: TCP (6)
    Header checksum: 0x563b [validation disabled]
    [Header checksum status: Unverified]
    Source: 192.168.1.30
    Destination: 185.75.143.25
Transmission Control Protocol, Src Port: 58585, Dst Port: 80, Seq: 0, Len: 0

No.     Time           Source                Destination           Protocol Length Info
    438 81.004815251   192.168.1.30          185.75.143.25         TCP      74     33275 → 80 [SYN] Seq=0 Win=5840 Len=0 MSS=1460 SACK_PERM=1 TSval=3837575513 TSecr=0 WS=4

Frame 438: 74 bytes on wire (592 bits), 74 bytes captured (592 bits) on interface 0
Ethernet II, Src: HonHaiPr_6e:62:a4 (70:77:81:6e:62:a4), Dst: FreeboxS_3f:47:20 (70:fc:8f:3f:47:20)
Internet Protocol Version 4, Src: 192.168.1.30, Dst: 185.75.143.25
    0100 .... = Version: 4
    .... 0101 = Header Length: 20 bytes (5)
    Differentiated Services Field: 0x00 (DSCP: CS0, ECN: Not-ECT)
    Total Length: 60
    Identification: 0x5957 (22871)
    Flags: 0x0000
    Time to live: 1
    Protocol: TCP (6)
    Header checksum: 0x563a [validation disabled]
    [Header checksum status: Unverified]
    Source: 192.168.1.30
    Destination: 185.75.143.25
Transmission Control Protocol, Src Port: 33275, Dst Port: 80, Seq: 0, Len: 0

No.     Time           Source                Destination           Protocol Length Info
    439 81.004898534   192.168.1.30          185.75.143.25         TCP      74     57489 → 80 [SYN] Seq=0 Win=5840 Len=0 MSS=1460 SACK_PERM=1 TSval=3837575513 TSecr=0 WS=4

Frame 439: 74 bytes on wire (592 bits), 74 bytes captured (592 bits) on interface 0
Ethernet II, Src: HonHaiPr_6e:62:a4 (70:77:81:6e:62:a4), Dst: FreeboxS_3f:47:20 (70:fc:8f:3f:47:20)
Internet Protocol Version 4, Src: 192.168.1.30, Dst: 185.75.143.25
    0100 .... = Version: 4
    .... 0101 = Header Length: 20 bytes (5)
    Differentiated Services Field: 0x00 (DSCP: CS0, ECN: Not-ECT)
    Total Length: 60
    Identification: 0x5958 (22872)
    Flags: 0x0000
    Time to live: 2
    Protocol: TCP (6)
    Header checksum: 0x5539 [validation disabled]
    [Header checksum status: Unverified]
    Source: 192.168.1.30
    Destination: 185.75.143.25
Transmission Control Protocol, Src Port: 57489, Dst Port: 80, Seq: 0, Len: 0
